smartctl 6.5 (build date Sep 26 2022) [x86_64-linux-4.4.302+] (local build)
Copyright (C) 2002-16, Bruce Allen, Christian Franke, www.smartmontools.org

=== START OF INFORMATION SECTION ===
Model Family:     Western Digital Caviar Green (AF)
Device Model:     WDC WD20EARS-00MVWB0
Serial Number:        WD-MOCKSERIAL01
LU WWN Device Id: 5 0014ee 6ab707df5
Firmware Version: 51.0AB51
User Capacity:    2,000,398,934,016 bytes [2.00 TB]
Sector Size:      512 bytes logical/physical
Device is:        In smartctl database [for details use: -P show]
ATA Version is:   ATA8-ACS (minor revision not indicated)
SATA Version is:  SATA 2.6, 3.0 Gb/s
Local Time is:    Tue May 12 09:38:16 2026 CEST
SMART support is: Available - device has SMART capability.
SMART support is: Enabled

=== START OF READ SMART DATA SECTION ===
SMART overall-health self-assessment test result: FAILED

General SMART Values:
Offline data collection status:  (0x05)	Offline data collection activity
					was aborted by an interrupting command from host.
					Auto Offline Data Collection: Disabled.
Self-test execution status:      (   0)	The previous self-test routine completed
					without error or no self-test has ever 
					been run.
Total time to complete Offline 
data collection: 		(36000) seconds.
Offline data collection
capabilities: 			 (0x7b) SMART execute Offline immediate.
					Auto Offline data collection on/off support.
					Suspend Offline collection upon new
					command.
					Offline surface scan supported.
					Self-test supported.
					Conveyance Self-test supported.
					Selective Self-test supported.
SMART capabilities:            (0x0003)	Saves SMART data before entering
					power-saving mode.
					Supports SMART auto save timer.
Error logging capability:        (0x01)	Error logging supported.
					General Purpose Logging supported.
Short self-test routine 
recommended polling time: 	 (   2) minutes.
Extended self-test routine
recommended polling time: 	 ( 347) minutes.
Conveyance self-test routine
recommended polling time: 	 (   5) minutes.
SCT capabilities: 	       (0x3035)	SCT Status supported.
					SCT Feature Control supported.
					SCT Data Table supported.

SMART Attributes Data Structure revision number: 16
Vendor Specific SMART Attributes with Thresholds:
ID# ATTRIBUTE_NAME                                                   FLAG     VALUE WORST THRESH TYPE      UPDATED  WHEN_FAILED RAW_VALUE
  1 Raw_Read_Error_Rate                                              0x002f   200   200   051    Pre-fail  Always       -       0
  3 Spin_Up_Time                                                     0x0027   253   164   021    Pre-fail  Always       -       1050
  4 Start_Stop_Count                                                 0x0032   088   088   000    Old_age   Always       -       12337
  5 Reallocated_Sector_Ct                                            0x0033   200   200   140    Pre-fail  Always       -       280
  7 Seek_Error_Rate                                                  0x002e   200   200   000    Old_age   Always       -       0
  9 Power_On_Hours                                                   0x0032   073   072   000    Old_age   Always       -       20095
 10 Spin_Retry_Count                                                 0x0032   100   100   000    Old_age   Always       -       0
 11 Calibration_Retry_Count                                          0x0032   100   100   000    Old_age   Always       -       0
 12 Power_Cycle_Count                                                0x0032   096   096   000    Old_age   Always       -       4666
192 Power-Off_Retract_Count                                          0x0032   200   200   000    Old_age   Always       -       252
193 Load_Cycle_Count                                                 0x0032   180   180   000    Old_age   Always       -       60665
194 Temperature_Celsius                                              0x0022   121   095   000    Old_age   Always       -       58
196 Reallocated_Event_Count                                          0x0032   200   200   000    Old_age   Always       -       0
197 Current_Pending_Sector                                           0x0032   200   200   000    Old_age   Always       -       4
198 Offline_Uncorrectable                                            0x0030   200   200   000    Old_age   Offline      -       0
199 UDMA_CRC_Error_Count                                             0x0032   200   200   000    Old_age   Always       -       0
200 Multi_Zone_Error_Rate                                            0x0008   200   200   000    Old_age   Offline      -       0

SMART Error Log Version: 1
No Errors Logged

SMART Self-test log structure revision number 1
Num  Test_Description    Status                  Remaining  LifeTime(hours)  LBA_of_first_error
# 1  Short offline       Completed without error       00%     13201         -
# 2  Short offline       Completed without error       00%     12846         -
# 3  Short offline       Completed without error       00%     12692         -
# 4  Short offline       Completed without error       00%     12499         -
# 5  Short offline       Completed without error       00%     12330         -
# 6  Short offline       Completed without error       00%     12151         -
# 7  Short offline       Completed without error       00%      9632         -

SMART Selective self-test log data structure revision number 1
 SPAN  MIN_LBA  MAX_LBA  CURRENT_TEST_STATUS
    1        0        0  Not_testing
    2        0        0  Not_testing
    3        0        0  Not_testing
    4        0        0  Not_testing
    5        0        0  Not_testing
Selective self-test flags (0x0):
  After scanning selected spans, do NOT read-scan remainder of disk.
If Selective self-test is pending on power-up, resume after 0 minute delay.

